{
  "report_schema_version": "1.0",
  "asset_id": "signed-sidecar",
  "content_hash": "3e40d196d8e45cc2d9d2e2ee2685fa0cd4cc977373922926c133ec4d7642c1ef",
  "pipeline_id": "provenance-analysis@1",
  "run_id": "2b9a5aec-63a3-4555-8d0a-90f70f963414",
  "structural": {
    "inspect": {
      "duration_sec": 0.5,
      "sample_rate": 44100,
      "channels": 1,
      "codec": "pcm_s16le",
      "bit_rate": 705600,
      "format_name": "wav",
      "format_profile": "pcm_s16le_706k",
      "content_hash": "3e40d196d8e45cc2d9d2e2ee2685fa0cd4cc977373922926c133ec4d7642c1ef"
    },
    "tags": {
      "tags": {}
    }
  },
  "verified": {
    "status": "valid",
    "results": [
      {
        "plugin_id": "verify.demo",
        "plugin_version": "0.1.0",
        "status": "valid",
        "details": {
          "issuer": "audio-prov-demo",
          "claims": {
            "synthetic": true,
            "generator": "fixture-generator",
            "content_id": "signed-sidecar"
          },
          "signing_note": "demo-development-key"
        }
      },
      {
        "plugin_id": "verify.c2pa",
        "plugin_version": "0.1.0",
        "status": "absent",
        "details": {
          "reason": "c2patool_not_installed",
          "hint": "Install c2patool or set path: c2patool"
        }
      }
    ]
  },
  "simulated": null,
  "inferred": {
    "status": "stub",
    "results": [
      {
        "plugin_id": "detect.stub",
        "plugin_version": "0.1.0",
        "status": "stub",
        "signals": [],
        "details": {
          "message": "No external AI detector configured. Signals above are tag/hint based only.",
          "path": "/Users/yyf/Code/ai-audio-provenance/fixtures/signed-sidecar.wav"
        }
      }
    ],
    "disclaimer": "Inferred signals are not proof of synthetic or human origin. External detectors may be added via DetectPlugin."
  },
  "user_hints": {},
  "disclaimer": "Analysis reports technical evidence only. Absent credentials do not prove synthetic origin. Demo sidecar manifests use development keys only."
}